{"capability_ids":["source-dispatch-interval-capture"],"control_result_refs":["sha256:f5bbb3eb499811d30f89efeb8c40d5d2ca61c0294ed72a0b5256525042fddc48"],"control_suite_ref":"sha256:748c2ea7952873b693833ff9b33b5a66f6746d9536abad383b2319a49726b816","implementation_ref":"sha256:d08bbdf5e9cb20aab47f734cb49939ce074da5785b3211927e12baa37be83547","input_profile_ref":"sha256:f2e65cee21d5f5265dbd40556ac58b93600c5cec1dc6c1068f2b4bdb5e92e693","limitations":["Raw intervals only; no witness/occurrence/trace publication","No qualified horizon/queue/completion or business clock namespace","DB intermediate visibility and async causal/completion ABI remain PARTIAL"],"project_id":"ci3_reference","qualification_id":"ci3_source_windows_1","reason_codes":["EXECUTED_CONTROLLED_SOURCE_INTERVALS"],"schema_refs":["sha256:42c2c0a158ce68bd2ddb65f767880514bdbd2c443bb4df70d52c7e7b9c4aa64c","sha256:53e5dd6e7114cc22860cd7839831e8406a880d9e51be7088e9637b5425681e2a"],"schema_version":"1.0","status":"SUPPORTED","subject_kind":"ENGINE"}
