{"schema_version":"1.0","qualification_id":"ci3_reference_b1_fixture","project_id":"ci3_reference","subject_kind":"ENGINE","implementation_ref":"sha256:b0244d4761d9b10ddbeaac20b2f3300f8732f3e1139c93dca722e552ccc11294","schema_refs":["sha256:2634e7b0b41353c038b9d9671b544a4869ad26c253707716f6cf84d8631632e5","sha256:d06ad9a01ca8329d4a7454934d739b25bb7dfa355991f7380611059767714ebf"],"capability_ids":["ci3-reference-b1-source-fixture-evidence"],"input_profile_ref":"sha256:1319b41bc618b8b4ab95d41ca43062130b5f08bfa8de5179654f56a516f0bff5","control_suite_ref":"sha256:d9acd3f9e3dd282d1926c202ea1d5e1359a81c7fc223a1ce799a2ec5eec8f961","control_result_refs":["sha256:aa76600ad03e59a692847ee74a10c56c1e2b09113d34517c56949200755864fa","sha256:4db83cf5d3ce42edbde134031957389c3bff4dc96cbf84a2131a667448fc9998","sha256:8315d58763e161bd0ce92bf3c44e0d72428f59730cf2fb84fc1547d6d079d27f"],"limitations":["Fixture evidence reader only; no installed adapter, target session codec, customer admission or compatibility verdict","Database intermediate visibility/read sets/locks remain PARTIAL"],"status":"SUPPORTED","reason_codes":["EXECUTED_BOUNDED_SOURCE_FIXTURE"]}
