{"capability_ids":["source-synchronous-health-horizon"],"control_result_refs":["sha256:6411ee8b74b78a99a1001d26da2d2b789e1de2eaa53103c6d8133ac11ac6124b"],"control_suite_ref":"sha256:2755e8b3b3cfeb71430e01f55582bd9c605bf9a82e3f0a60228604d9b1059ef0","implementation_ref":"sha256:e92d028bd5be1039e2abaf94b38bf31175b757e11d8cf658416f74f2156f3796","input_profile_ref":"sha256:aac0656e9ad2011bb5164b21c8a1767cc446ee84b06e86b4360d89f9651cca3a","limitations":["Only pinned /health with empty job queue, no native events/routines and no application event privileges","No retroactive qualification of windows-b1; scheduled/async scopes remain blocked","No witness/trace publication; DB intermediate and async causal/completion ABI remain PARTIAL"],"project_id":"ci3_reference","qualification_id":"ci3_health_horizon_1","reason_codes":["LIVE_QUEUE_CENSUS_AND_SYNCHRONOUS_CLOSURE"],"schema_refs":["sha256:42c2c0a158ce68bd2ddb65f767880514bdbd2c443bb4df70d52c7e7b9c4aa64c","sha256:53e5dd6e7114cc22860cd7839831e8406a880d9e51be7088e9637b5425681e2a"],"schema_version":"1.0","status":"SUPPORTED","subject_kind":"ENGINE"}
