{"capability_ids":["rwt-model-roles-1"],"control_result_refs":["sha256:3ada07d17939064c49b5aded56162c47242f9c2ef20ca5632449bfba4d11cb25"],"control_suite_ref":"sha256:62e8c89574fab25c26aea536fe72d150d6b87dcf907a46d878ad00b892b784bc","implementation_ref":"sha256:0d78049af3ed32c28bf2b78fd0e2a648cdd55b9002246e03225243bac5c53baf","input_profile_ref":"sha256:7c8b1db2332a5380eaf440d52b08834aac40cae4771b103485dde82906facd40","limitations":["Mediated SOURCE capture/checker handles only; same-account introspection is outside this boundary","No target execution, model interpreter, session codec or customer approval qualified","Old captures remain unqualified for this successor implementation","Controlled observation windows and witnessed trace publication not established","DB intermediate visibility and async causal/completion ABI remain PARTIAL"],"project_id":"ci3_reference","qualification_id":"ci3_source_roles_1","reason_codes":["EXECUTED_SOURCE_ROLE_HANDLE_CONTROLS"],"schema_refs":["sha256:2771e54a774a8f108de478444c48c44c1ee5666027681685619ee2ccf927ff9c","sha256:53e5dd6e7114cc22860cd7839831e8406a880d9e51be7088e9637b5425681e2a","sha256:69ff65cafa163ffa1d4c834467db7e046a57972e207c94db248e30127fa866cb"],"schema_version":"1.0","status":"SUPPORTED","subject_kind":"ENGINE"}
