{"capability_ids":["source-independent-receipt-ack-send-timing"],"control_result_refs":["sha256:0646b23fa021abd3bd08f6d4a2344d6e6192480d96062dbc772d5b0223827be7"],"control_suite_ref":"sha256:f02cb12fde40eceb62544a03f4699a2e57b7e686739efd5016804ee68a292c47","implementation_ref":"sha256:7b95c67f940336f590a0d895aa2365222dc129f390d0f84f48d9a00c1049c660","input_profile_ref":"sha256:c786ab93cd97b47e5d39495a3843b3b8ccf71216428dcefb12d22f807fb47955","limitations":["Transport acceptance/send only; no independently witnessed worker ACK consumption","No qualified horizon/due/quiescence/completion; aggregate async ABI and DB intermediate visibility PARTIAL","New disposable source revision only; original B1 and earlier causal revision not upgraded"],"project_id":"ci3_reference","qualification_id":"ci3_receipt_transport_timing_1","reason_codes":["EXECUTED_INDEPENDENT_RECEIVER_BOUNDARIES"],"schema_refs":["sha256:85efd5d40cb2b08bdb77efc560de42e975580b78ca6e5abb0eb32eef81b4ae45"],"schema_version":"1.0","status":"SUPPORTED","subject_kind":"ENGINE"}
