{"capability_ids":["source-job-envelope-propagation"],"control_result_refs":["sha256:05e79011e748859cf3a1d7bbfb6265368d2ee0a306fc72b758d3e8f965871678"],"control_suite_ref":"sha256:726712848c449ef526f4e7dac496585ed0dba24d7eb187cac959da9b0445e2db","implementation_ref":"sha256:9abd77c2acf136cac6cde7c9b10256b619f7b1ef4c02b89b6ca0f40f8089924e","input_profile_ref":"sha256:3da8a11fc86915b759a59f3e16cdc9d9baef49d88d9e70a2dd87a0d67e605bf7","limitations":["New disposable source revision only; original B1 not upgraded","Carrier only; worker process field is application-emitted, not independently witnessed","No independent wire ACK timing, qualified horizon/quiescence or completion","DB intermediate and async causal/completion ABI remain PARTIAL"],"project_id":"ci3_reference","qualification_id":"ci3_causal_carrier_1","reason_codes":["EXECUTED_PRODUCER_QUEUE_WORKER_RECEIVER_CARRIER"],"schema_refs":["sha256:b0feb921f1d35ed299236cdaa58a9e648bc0bec1d522888d3ab0f98f875256dc"],"schema_version":"1.0","status":"SUPPORTED","subject_kind":"ENGINE"}
