{"capability_ids":["source-async-causal-completion"],"control_result_refs":["sha256:fc4cd73416eadd3e8d1393adc54b39d8f489505e813b6f1a91ac4f9c453b78e0"],"control_suite_ref":"sha256:2e40738cf0558e1608081f7102fdb62b734368496bf4109003de69bbe2b76af9","implementation_ref":"sha256:d2ad7004b7ebceda8c396e42f4a1f97a1d0f2505de3937c83c598d731d8784c9","input_profile_ref":"sha256:38a4a22bb4f527c1c9a446a861ee77469b4d69cbc063944102fc83dad9772a02","limitations":["Existing raw stages only; no qualified due/horizon or causal completion","DB intermediate visibility and async causal/completion ABI remain PARTIAL","No witness/occurrence/trace publication"],"project_id":"ci3_reference","qualification_id":"ci3_async_completion_attempt_1","reason_codes":["missing-queue-causal-envelope","missing-worker-parent-span","missing-independent-wire-receipt-and-ack","missing-initiating-dispatch-delivery-timing","missing-qualified-due-schedule-and-quiescence"],"schema_refs":["sha256:b0feb921f1d35ed299236cdaa58a9e648bc0bec1d522888d3ab0f98f875256dc","sha256:85efd5d40cb2b08bdb77efc560de42e975580b78ca6e5abb0eb32eef81b4ae45","sha256:42c2c0a158ce68bd2ddb65f767880514bdbd2c443bb4df70d52c7e7b9c4aa64c"],"schema_version":"1.0","status":"INCONCLUSIVE","subject_kind":"ENGINE"}
